{"$schema":"https://json-schema.org/draft/2020-12/schema","$id":"renderer-typography-v1","type":"object","additionalProperties":false,"required":["schemaVersion","id","version","owner","paper","projectionContract","rules"],"properties":{"schemaVersion":{"const":"renderer-typography-v1"},"id":{"type":"string"},"version":{"type":"string"},"owner":{"const":"renderer_typography"},"paper":{"type":"string"},"projectionContract":{"type":"string"},"rules":{"type":"array"}}}
